{
  "schema_version": "0.1.0",
  "record_id": "logos:chunk:000001",
  "source": {
    "document_id": "logos-doc-0042",
    "source_sha256": "9f2b0c4a1e8d7f6a5b4c3d2e1f0a9b8c7d6e5f4a3b2c1d0e9f8a7b6c5d4e3f2a",
    "source_version": "1.0.0",
    "span": {
      "start_char": 18240,
      "end_char": 23119,
      "page_start": 14,
      "page_end": 16
    }
  },
  "task": {
    "name": "semantic_chunking",
    "task_version": "0.1.0",
    "spec_version": "chunk-spec-0.1.0"
  },
  "candidate": {
    "candidate_id": "c-03",
    "producer_type": "llm",
    "producer": "model-family-b-chunker",
    "producer_family": "vendor-b-frontier",
    "producer_version": "2026-07",
    "prompt_hash": "sha256:1c9a7e5f3b2d4c6a8e0f2b4d6c8a0e2f4b6d8c0a2e4f6b8d0c2a4e6f8b0d2c4a",
    "retrieval_snapshot": "corpus-0.4.2",
    "code_commit": "0000000000000000000000000000000000000000",
    "seed": 2718
  },
  "hard_checks": {
    "round_trip_reconstruction": true,
    "omitted_codepoints": 0,
    "added_codepoints": 0,
    "offsets_valid": true,
    "unicode_policy_pass": true
  },
  "judge_results": [
    {
      "judge": "model-family-c-judge",
      "judge_family": "vendor-c-frontier",
      "rubric_version": "chunk-rubric-0.1",
      "pair_order": "candidate_first",
      "scores": {
        "semantic_coherence": 4,
        "heading_attachment": 5,
        "retrieval_suitability": 4
      }
    }
  ],
  "aggregate": {
    "accept_probability": 0.91,
    "uncertainty": 0.09,
    "decision_policy": "decision-policy-0.1"
  },
  "status": "s1_machine_filtered",
  "human_adjudication": null,
  "confidentiality_tier": "internal",
  "created_at": "2026-07-20T00:00:00Z"
}
